{
  "exported_at": "2025-10-28T23:01:35.367015",
  "description": "Initial market state documents for MongoDB",
  "collection": "market_state",
  "documents": [
    {
      "product": "FOSFO",
      "bestBid": 12.25,
      "bestAsk": 12.75,
      "mid": 12.5,
      "lastTradePrice": 12.5,
      "volume24h": 0,
      "lastUpdated": "2025-10-29T04:01:35.366865",
      "description": "Fosforo Aguacate - Premium quality phosphorus-enriched avocados",
      "initialBasePrice": 12.5
    },
    {
      "product": "PITA",
      "bestBid": 8.57,
      "bestAsk": 8.93,
      "mid": 8.75,
      "lastTradePrice": 8.75,
      "volume24h": 0,
      "lastUpdated": "2025-10-29T04:01:35.367005",
      "description": "Pita Avocados - Standard trading grade avocados",
      "initialBasePrice": 8.75
    },
    {
      "product": "PALTA-OIL",
      "bestBid": 24.5,
      "bestAsk": 25.5,
      "mid": 25.0,
      "lastTradePrice": 25.0,
      "volume24h": 0,
      "lastUpdated": "2025-10-29T04:01:35.367009",
      "description": "Palta Oil - Refined avocado oil for intergalactic cooking",
      "initialBasePrice": 25.0
    },
    {
      "product": "GUACA",
      "bestBid": 14.99,
      "bestAsk": 15.61,
      "mid": 15.3,
      "lastTradePrice": 15.3,
      "volume24h": 0,
      "lastUpdated": "2025-10-29T04:01:35.367011",
      "description": "Guacamole Base - Ready-to-prepare guacamole ingredients",
      "initialBasePrice": 15.3
    },
    {
      "product": "SEBO",
      "bestBid": 18.52,
      "bestAsk": 19.28,
      "mid": 18.9,
      "lastTradePrice": 18.9,
      "volume24h": 0,
      "lastUpdated": "2025-10-29T04:01:35.367013",
      "description": "Sebo Avocado Fat - Industrial grade avocado fat",
      "initialBasePrice": 18.9
    },
    {
      "product": "H-GUACA",
      "bestBid": 44.69,
      "bestAsk": 46.51,
      "mid": 45.6,
      "lastTradePrice": 45.6,
      "volume24h": 0,
      "lastUpdated": "2025-10-29T04:01:35.367014",
      "description": "Hydrogen Guacamole - Advanced processed guacamole with extended shelf life",
      "initialBasePrice": 45.6
    }
  ],
  "insert_command": "db.market_state.insertMany([\n  {\n    \"product\": \"FOSFO\",\n    \"bestBid\": 12.25,\n    \"bestAsk\": 12.75,\n    \"mid\": 12.5,\n    \"lastTradePrice\": 12.5,\n    \"volume24h\": 0,\n    \"lastUpdated\": \"2025-10-29T04:01:35.366865\",\n    \"description\": \"Fosforo Aguacate - Premium quality phosphorus-enriched avocados\",\n    \"initialBasePrice\": 12.5\n  },\n  {\n    \"product\": \"PITA\",\n    \"bestBid\": 8.57,\n    \"bestAsk\": 8.93,\n    \"mid\": 8.75,\n    \"lastTradePrice\": 8.75,\n    \"volume24h\": 0,\n    \"lastUpdated\": \"2025-10-29T04:01:35.367005\",\n    \"description\": \"Pita Avocados - Standard trading grade avocados\",\n    \"initialBasePrice\": 8.75\n  },\n  {\n    \"product\": \"PALTA-OIL\",\n    \"bestBid\": 24.5,\n    \"bestAsk\": 25.5,\n    \"mid\": 25.0,\n    \"lastTradePrice\": 25.0,\n    \"volume24h\": 0,\n    \"lastUpdated\": \"2025-10-29T04:01:35.367009\",\n    \"description\": \"Palta Oil - Refined avocado oil for intergalactic cooking\",\n    \"initialBasePrice\": 25.0\n  },\n  {\n    \"product\": \"GUACA\",\n    \"bestBid\": 14.99,\n    \"bestAsk\": 15.61,\n    \"mid\": 15.3,\n    \"lastTradePrice\": 15.3,\n    \"volume24h\": 0,\n    \"lastUpdated\": \"2025-10-29T04:01:35.367011\",\n    \"description\": \"Guacamole Base - Ready-to-prepare guacamole ingredients\",\n    \"initialBasePrice\": 15.3\n  },\n  {\n    \"product\": \"SEBO\",\n    \"bestBid\": 18.52,\n    \"bestAsk\": 19.28,\n    \"mid\": 18.9,\n    \"lastTradePrice\": 18.9,\n    \"volume24h\": 0,\n    \"lastUpdated\": \"2025-10-29T04:01:35.367013\",\n    \"description\": \"Sebo Avocado Fat - Industrial grade avocado fat\",\n    \"initialBasePrice\": 18.9\n  },\n  {\n    \"product\": \"H-GUACA\",\n    \"bestBid\": 44.69,\n    \"bestAsk\": 46.51,\n    \"mid\": 45.6,\n    \"lastTradePrice\": 45.6,\n    \"volume24h\": 0,\n    \"lastUpdated\": \"2025-10-29T04:01:35.367014\",\n    \"description\": \"Hydrogen Guacamole - Advanced processed guacamole with extended shelf life\",\n    \"initialBasePrice\": 45.6\n  }\n])"
}